"Ovo nije ispit moralnosti; moral se ovdje, kako kaže jedan od likova, tretira kao ""vječno promjenjiva skupina različitih briga""."	neutralno
Ostavi svijet za sobom – proročki, jer je pisan prije pandemije koronavirusa – razotkriva da je društveni poredak tu kako bi većina nas mogla živjeti u uvjerenju da u stvari nisu društvene životinje.	neutralno
Sve se drži na okupu prešutnim sporazumom da će sve ostati na okupu.	neutralno
"Potrebno je samo da jedna strana odluči da će se sve raspasti kako bi do toga zaista i došlo.
Ne postoji struktura koja bi spriječila kaos, postoji samo kolektivno vjerovanje u red."	neutralno
"A kad se red raspadne, većina nas neće učiniti baš ništa jer je strah nešto divlje i osobno, ""nešto što čuvate u sebi jer se nadate da ćete ga tako onesposobiti""."	neutralno
I završno, trik-pitanje: kako da nastavimo voljeti druge ljude, i primati njihovu ljubav, sad kad smo svjesni da jedni druge ne možemo spasiti?Roman Rumaana Alama balansira na osjetljivoj granici ugode i nelagode; dovoljan je tek blagi povjetarac – jedna riječ – da vas prebaci na jednu ili drugu stranu.	neutralno
Dio čitatelja će sigurno biti razočaran krajem, no ovakav autorski odabir je ono što razgraničava nisku od visoke literature: prva će vam ponuditi pravocrtne i nerijetko moralne svršetke, druga će vam izmaknuti tlo pod nogama i pustiti da mašta odradi ono što je literatura tek načela.	negativno
Marija Brkljačića, jednog od naših najboljih kratkopričaša, dugo je trebalo nagovarati da objavi papirnatu knjigu.	pozitivno
"U maloj zemlji, gdje gotovo svatko u ladici pisaćeg stola drži rukopis i uvjeren je da je neotkriveni talent za prozu ili poeziju, Brkljačić je kuriozitet: godinama je objavljivao elektroničke knjige na Besplatnim elektroničkim knjigama Krešimira Pintarića, da bi ga 2019. u Durieuxu nagovorili na tiskanu zbirku priča ""Doručak za Bič""."	pozitivno
U gotovo svim trenucima Sam je sam.	neutralno
"Dok je mlađi, majka mu objašnjava da se mora uklopiti u zajednicu kad završi školu jer ""čovjek je, Sam, društveno biće"", iako zna da je majka ""sama sa mnom."	neutralno
"I ja sam, s njom""."	neutralno
"Većinu vremena Samu je ""neizdrživo biti u svijetu, a htjeti pobjeći od svijeta""; ljudi kod Brkljačića ""postoje kao što postoje i čavli zakucani u zid""."	negativno
Na to temeljno pitanje – kako se nositi sa samoćom, a biološki smo uvjetovani kao društvena bića – Brkljačić ne nudi odgovor.	negativno
Razrješenje ne daje ni Samu, i on ga – kao pripovjedač – u jednom trenutku napušta pa čitatelj ne dobiva (zadovoljavajući) kraj.	negativno
"Kao zbirka priča, ""Sam"" bi bolje funkcionirao."	negativno
Kao roman, zapinje – Brkljačić prozne fragmente nije dovoljno povezao da funkcioniraju kao cjelina.	negativno
Dojam je da je počeo pisati roman o dječaku Samu koji je izgubio oca, ali ga nije uspio dovesti do završetka pa je radnji koja nedostaje dodao nepovezane priče i opravdao ih Samovim snovima.	negativno
Sam zbog toga ostavlja dojam da je dijelom skrpan od zaostalog materijala, tim više što je neke dijelove romana autor prethodno objavio kao priče.	negativno
Za jednu je priču dobio nagradu Večernjeg lista, drugu je objavio nedavno u Expressu.	neutralno
U toj verziji su tri poglavlja romana presložena u pripovijetku.	neutralno
Jedno je poglavlje neznatno promijenio i pretvorio u posvetu Danilu Kišu preobraženom u konobara, no u romanu Kiša nema.	neutralno
Brkljačić svoju prozu, čini se, tretira kao radni materijal i preslaguje ju – može se, uvjetno rečeno, pratiti proizvodni proces.* Kritika je originalno objavljena u prilogu Kritičar magazina Svijet kulture Jutarnjeg lista.	negativno
Esther Kinsky spisateljica je i prevoditeljica s poljskog, ruskog i engleskog.	neutralno
"Njezin roman ""Rijeka"" (Sandorf, prijevod Anda Bukvić Pažin), ""atmosferičan, evokativan, poetičan, stilski profinjen"", došao nam je u prijevodu Ande Bukvić Pažin, a objavljen je u izdavačkoj kući Sandorf."	pozitivno
Ovaj roman ili možda putopis, zaokruženi zapis o rijekama kojima je spisateljica prilazila, na koje je pazila i čije je tokove pratila, maestralna je hibridna forma, sugestivna i lako protočna, valjda poput vode koja je provodni motiv zbirke.	pozitivno
No ovaj roman s elementima putopisa o vodama tekućicama čvrsto se drži romanesknih obala, ponajprije glasom pripovjedačice, a onda i stalnim likovima koji su poput molova za koji se priča povremeno vezuje.	pozitivno
"Rubovi naselja, rubovi kontinenta, rubovi rijeka, dvorišta i livada, sve ono što je izgred ""betonske izgrede kolodvora"" za autoricu je pozornica u koju ima pozorno usmjeren pogled, pažnju i razumijevanje."	pozitivno
I ljubav.	neutralno
Dinamika slika se izmjenjuje u treperenju osjetila, veliki teretni brodovi u magličastom isparavanju rijeke, difuzno svjetlo u izmjenama noći i dana, vjetrovi i tržnice s arsenalom fenomena kako se sve to i dalje održava na životu – to je glavna okosnica romana koji će onima koji tragaju za smislom u jeziku i čulima biti zasigurno jedan od najbljih romana, rječnika, vodiča, udžbenika i za čijom će atmosferom tragati u svojim lutanjima.	pozitivno
Kad je u svojim tinejdžerskim godinama prvi put pokušala pisati, njezin djed, književni kritičar Malcolm Cowley, dao joj je savjet koji je otad uvijek uz nju: jedino što moraš znati, rekao je, jest to da svaka dobra priča mora imati početak, sredinu i kraj, a kraj mora biti nagoviješten na početku.	neutralno
Kad joj je bilo jedanaest, otac Robert Cowley, urednik i izvanredan povjesničar, rekao joj je pak kako je najbolje pisanje uvijek najkraća udaljenost između dvije točke.	neutralno
Miranda Cowley Heller poslušala je djeda, oca nije.	neutralno
"Njezin roman prvijenac ""Palača od papira"", upravo objavljen na hrvatskom jeziku, u nakladi izdavačke kuće Znanje i prijevodu Ivane Mirošević, sa svojih više od 400 stranica sigurno nije najkraća udaljenost između dvije točke na papiru, ali kraj jest moguće naslutiti odmah na početku."	neutralno
Ili nije?	neutralno
O tome se već godinu dana u Sjedinjenim Državama vode ostrašćene i žilave rasprave.	neutralno
"Nije baš pravilo književnu recenziju počinjati od kraja (bez brige, neću ništa otkriti!), no magična privlačnost ""Palače od papira"" upravo je u ambivalentnom svršetku."	pozitivno
Iako Miranda Cowley Heller sama tvrdi kako ne voli nejasne završetke, upravo je takav napisala, ostavljajući čitatelje u agoniji oko toga kako je ova obiteljska i ljubavna drama skončala.	negativno
Što je neke nagnalo da roman čitaju ispočetka i tvrde da je – ako se pažljivo čita – sve vrlo jasno.	neutralno
Palača od papira ima naoko jednostavan zaplet: čitava radnja sabijena je u jedan dan, 24 sata, a zbiva se u Palači od papira, kako se zove kamp što ga čini nekoliko brvnara, a  koji je na obali jezera skrivenog u Back Woodsu na poluotoku Cape Cod sagradio pripovjedačičin djed.	neutralno
Izvana, brvnare su čvrste – otporne kućice u tradicionalnom novoengleskom stilu koje su izdržale beskrajne oštre zime i sjevernjake i generacije zavađenih obitelji.	neutralno
No djedu je pri gradnji ponestalo novca pa je unutarnje zidove i stropove izgradio od prešanog kartona.	neutralno
Simbolika je, rekla bih, sračunato razvidna: kakve su brvnare, takvi su i junaci ovoga romana – izvana stameni, iznutra vječna hrana miševima (koje s početkom svakog ljeta treba iznova rastjerati). 	neutralno
Naratorica je Elle, pedesetogodišnja profesorica književnosti, majka troje djece – sedamnaestogodišnjeg Jacka, desetogodišnje Maddy i devetogodišnjeg Finna, tzv. irskih blizanaca (djeca koja se rode unutar iste kalendarske godine), sretno udana za šarmantnog, seksepilnog britanskog novinara Petera.	neutralno
Radnja počinje u 6.30 sati prvog dana kolovoza, Elle se budi i odlazi na svoje uobičajeno jutarnje plivanje.	neutralno
No jutro nije obično jer je večer prije Elle učinila nezamislivo: poševila se s Jonasom, svojim najboljim prijateljem još od djetinjstva, potajno naravno, ali usred obiteljske večere kojoj su, osim njezina muža i djece, prisustvovali i njezina majka Wallace, Jonasova supruga Gina i drugi obiteljski prijatelji.	neutralno
Dok snažnim zamasima prevaljuje jezero, Elle je jasno da povratka više nema.	neutralno
"Nema više žaljenja za onim što nisam učinila.
Odsad samo žaljenje zbog onoga što jesam učinila.
Volim ga, mrzim sebe; volim sebe, mrzim njega.
To je kraj jedne duge priče."	neutralno
Iako je Mirandi Cowley Heller ovo prvi roman, ona itekako zna što radi.	pozitivno
"Ne samo da je odrasla u New Yorku u obitelji umjetnika, pisaca i urednika – što je i društveni sloj u koji smješta radnju svojega romana, a Cape Cod je njegov Camelot – nego je i gotovo desetljeće provela radeći na HBO-u kao šefica svih dramskih serija, razvijajući i nadgledajući stvaranje TV drama poput ""Obitelji Soprano"", ""Dva metra pod zemljom"" i ""Žica""."	neutralno
"To iskustvo jasno se osjeća dok se čita ""Palača od papira"" jer Cowley Heller ima sjajan osjećaj za dramatiku, tempo i suspense."	pozitivno
Prije svega, izvanredna je graditeljica priče – četiri stotine stranica, usprkos očevu savjetu, nije potrošeno uzalud, pri čemu se autorica ne oslanja na često površan thrill karakterističan za žanrovske televizijske (i književne) formate – ne baca jeftine mamce, nego vas zaljubljuje u likove i priču.	pozitivno
"Potpuno je jasno zašto je HBO odmah otkupio prava na roman za televizijsku seriju: ""Palača od papira"" lako bi mogla postati nove ""Male prljave laži""!"	pozitivno
Jedan mamac autorica, naravno, odmah baca pred čitatelja: znamo što je učinila, prevarila je supruga, i znamo da zbog toga osjeća i opipljivo (seksualno) uzbuđenje i mučnu grižnju savjesti.	pozitivno
Ne znamo zašto je to učinila i koga će odabrati.	neutralno
Iz zapaljive scene ševe – roman obiluje prizorima sočnoga seksa! – uvodi nas ravno u obiteljsku dramu koja se proteže desetljećima.	pozitivno
"U obitelji Elleine majke Wallace – a ""Palača od papira"" sva je posvećena ženama – rastava je tek riječ od sedam slova, nešto što ljudi čine kad im postane dosadno u braku ili kad shvate da im ne ide."	neutralno
Oboje Wallaceinih  roditelja triput je bilo u braku, Wallace dvaput, no u njoj je, opisuje ju njezina kći Elle, nešto bezvremeno: prava je gnjavatorica, no krasi je veličanstveno dostojanstvo.	neutralno
"To je vrsta majke koja vjeruje da je „rastava dobra za djecu“ jer su nesretni ljudi uvijek zanimljiviji, i to je vrsta majke koja je Elleinu sestrinsku ljubomoru na dvije godine stariju Annu razriješila ovim riječima: ""Moraš oprati tanjure… nećeš dobiti ruž."	neutralno
A ja sam morala svom očuhu popušiti kurac.	neutralno
Austin mu ga je samo trebao izdrkati.	neutralno
Što da ti kažem?	neutralno
"Život nije pravedan."""	neutralno
Njezin najgori savjet?	neutralno
"Sjeti se Botticellija.
Budi poput Venere koja se uzdiže iz školjke, usana smjerno zatvorenih, čedne čak i u svojoj nagosti.“
Drugim riječima: „Molim te, potrudi se i nemoj cijelo vrijeme biti tako teška.
Ne govori puno i izgledaj tajanstveno."	neutralno
Wallace ima 73 godine, otvoreno je zaljubljena u Elleina supruga Petera, ali Elle neopisivo živcira, najviše zato što joj Elle nikad nije rekla pravu istinu o tragičnom udesu koji je razdvojio nju i Jonasa.	neutralno
Elle i Jonas upoznali su se u Back Woodsu kad je njemu bilo osam, a njoj jedanaest godina.	neutralno
"Jonas je, kao i njegova supruga Gina, umjetnik, i uz to zgodan, ""gusta crna kosa koju možeš zagrabiti šakom, blijedozelene oči, koža ispolirana snagom i čežnjom, divlje stvorenje, najljepši čovjek na Zemlji""."	neutralno
Pored toga, on je osoba uz koju Elle ne osjeća nezgrapnost.	neutralno
Nema napetosti.	neutralno
Samo prisnost.	neutralno
I Peter je zgodan (jer zašto bi išta olakšalo izbor?).	neutralno
Nije prekrasan, već zgodan na onaj staromodan način filmske zvijezde.	neutralno
Visok.	neutralno
Elegantan.	neutralno
Britanac.	neutralno
Ugledan novinar.	neutralno
Onaj tip muškarca koji izgleda seksi u odijelu.	neutralno
Aristokratskog držanja.	neutralno
Strpljiv, no zastrašujuć kad se naljuti.	neutralno
Može čuvati tajnu.	neutralno
Rijetko mu nešto promakne.	neutralno
Kad je uzbuđen, pocrvene mu vrhovi ušiju.	neutralno
Ima dugačak korak.	neutralno
On Elle uravnotežuje, čini da se osjeća sigurnom.	neutralno
Ima izdužene, elegantne ruke.	neutralno
Uvijek daje novac prosjacima, gleda ih u oči s poštovanjem.	neutralno
Najviše od svega, Elle voli osobu koju vidi kad je on pogleda.	neutralno
Vlastiti narcizam ipak najviše očarava; u tom je smislu Elle uistinu žena svoga doba – voli ona i svoje muškarce i svoju djecu i svoju majku, ali najviše voli kad vole nju.	neutralno
Palača od papira nije sentimentalni ljubić, barem ne sve do samoga kraja.	neutralno
Poneka rješenja – o kojima ne mogu govoriti, a da ne otkrijem ključnu tajnu romana – tanašno su izvedena, meni osobno kao čitateljici neuvjerljiva, primjerice ono koje omogućuje Elle i Jonasu da prestanu osjećati sjenu srama.	negativno
"No ""Palača"" istodobno otvara važne teme braka, roditeljstva, ženskog identiteta i autonomnosti, obiteljskog nasilja i žrtvovanja, svakako i ljubavi – bavi se svim onim dvojbama koje suvremenog čovjeka, navodno slobodnijeg nego ikad prije, zakucavaju u asfalt dok juri automobilom na posao, vozi se možda podzemnom ili vlakom, i ne stigne o dvojbama razmisliti više od nekoliko minuta, sve dok ga navečer u krevet ne obori umor, a onda do jutra mlati nesanica. "	pozitivno
Ono što je nekad bio roman, danas je televizijski serija: odgovori, makar i površni, ne traže se više u knjigama (ili razgovoru), nego u televizoru ili na laptopu.	neutralno
Miranda Cowley Heller spojila je najbolje od oba svijeta u svojem romanu: dobili smo trodimenzionalnu napeticu utisnutu u dubinu dvodimenzionalnog papira.	pozitivno
Kraj je možda takav, ambivalentan, zašto je autorica ipak deset godina bila televizijska majka; teško se oteti porivu za nastavkom, za novom sezonom.	negativno
"Jedva čekam da dovoljan broj domaćih čitatelja savlada ""Palaču od papira"" i da počnu – igre strasti."	pozitivno
"Ja sam ""team Peter"". "	neutralno
"Od knjige ""Sva radosna mjesta"" prije par godina nije se moglo pobjeći."	neutralno
Naslovnica knjige iskakala je iz gotovo svih izloga, a internet ne treba ni spominjati.	neutralno
Upravo taj hype privukao me i odbio knjizi – krenula sam je čitati, odložila i uzela tek par godina kasnije.	neutralno
U međuvremenu je izašla i filmska adaptacija, i to 2020. godine, koja je također stekla veliki broj obožavatelja.	neutralno
Nije ovo remek-djelo svjetske literature, ali vrijednost definitivno ima.	pozitivno
Jer diže glas o onome o čemu se rijetko govori, a pred čime se često zatvara oči.	pozitivno
Jedna je mlada žena rodila četvero djece u razmaku od četrnaest godina.	neutralno
U majčinstvo je upala bez nakane, proizvevši niz kćeri različitih boja kose i različitih stupnjeva nelagode.	neutralno
"Najprije je došla Wendy, ""emocionalno klimava još od ranog djetinjstva"", koju će život nemilosrdno razapinjati."	neutralno
Ni godinu dana kasnije na svijet je stigla Violet, kći koja im nikada nije dala razloga za brigu, a odrast će u poduzetnu i žestoku ženu.	neutralno
"Četiri godine poslije u obitelj Sorenson stigla je Liza, bezbrižno tvrdoglava, ""jednostavno dobra – bila je to komplicirana, snažna vrsta dobrote koja je zračila iz nje, tako da bi i muškarci i žene zastali i samo joj se smiješili, nekako osunčani njezinom prisutnošću""."	neutralno
"I nakon još devet godina posljednja, Grace, obiteljska beba, otac David ponekad ju je nazivao ""jedinom jedinicom na svijetu koja ima tri sestre""."	neutralno
U svakoj od kćeri Marilyn Sorenson – majka s početka ove priče – mogla je vidjeti sebe, uglavnom ono što na sebi nije voljela.	neutralno
"Violet je znala kako se praviti hrabrom, pa makar i na vlastitu štetu.
Liza je svoje roditelje gledala s pretjeranim divljenjem (...)
Grace je bila prilagodljiva i izbjegavala je sukobe.
No Wendy ju je najviše opsjedala.
Njezina je kći bila nagla, kompulzivna, nemirna.
Bila je iskrena baš kao i Marilyn prije djece.
Bila je nesigurna, samokritična i autodestruktivna."	neutralno
"S te četiri kćeri, na naslovnici knjige simbolično prikazane kao četiri lista ginka, počinje debitantski roman mlade američke spisateljice Claire Lombardo, ""Najbolja zabava u životu"", koji je upravo, u prijevodu Ivane Ostojčić, objavila također mlada nakladnička kuća Sonatina naklada."	neutralno
Iza Sonatine stoji vlasnica i glavna urednica Silvia Sinković, do prije godinu dana višegodišnja glavna urednica nakladničke kuće Znanje, a njezino ime ističem jer njoj imamo zahvaliti na izvanrednom uredničkom odabiru.	pozitivno
"Nisam inače sklona takvim kategoričkim ocjenama, no približava se kraj godine pa ipak mogu donijeti tu vrstu suda: ""Najbolja zabava u životu"" najbolji je prijevodni roman koji sam ove godine pročitala."	pozitivno
Zapravo, najbolji roman koji sam ove godine pročitala.	pozitivno
Prvijenac Claire Lombardo obiteljski je roman, pametno i duhovito napisan, a polifona priča – u kojoj ravnopravno pratimo čak sedam glavnih junaka – toliko je vješto napisana i toliko čvrsto grabi čitatelja da na kraju romana od 544 stranice iskreno ostaje u čudu.	pozitivno
Lombardo, naime, u ovom trenutku ima trideset dvije godine, roman je objavila prije dvije godine, a počela ga je pisati kad je imala samo dvadeset četiri.	neutralno
To naoko ne bi trebalo biti iznenađenje – zašto ne bi mlada spisateljica mogla napisati roman koji je odmah postao bestseler The New York Timesa?	neutralno
"No ""Najbolja zabava u životu"" nije bilo kakav roman: ako ste pročitali bilo koji roman Jonathana Franzena, paralele će se same povlačiti – Sorensoni iz Chicaga novi su Berglundi iz ""Slobode"", ili novi Lamberti, Franzenova kaotična, problematična obitelj iz ""Korekcija"" zahvaljujući kojoj je njegov roman iz 2001. godine zaradio laskavu titulu ""prvog pravog romana novog tisućljeća""."	pozitivno
"Istodobno, napet odnos Pip i njezine majke Penelope iz romana ""Čistoća"" u ""Najboljoj zabavi"" je učetverostručen: imamo i dalje jednu majku, ali i četiri kompleksna odnosa koje razvija sa svojim kćerima."	pozitivno
Ovim ne želim reći da je Claire Lombardo kopirala Franzena, jer nije, nego želim reći – ako volite Jonathana Franzena, velike su šanse da ćete Claire Lombardo voljeti još više.	pozitivno
"Lombardo jest ženski Franzen, koliko god ova tvrdnja na prvu zvučala seksistički: ne znam hoće li ""Najbolja zabava u životu"" s vremenom zaraditi i laskavu titulu ""velikog američkog romana"", kojom Franzena redovito kite, jer Lombardo svoj kritički žalac ne usmjerava na društvene okolnosti, njezini junaci ne promatraju ptice niti zapjenjeno protestiraju protiv Appleovih proizvoda."	neutralno
Lombardo čini nešto sasvim drugo, bolje: u ruci drži skalpel i njime duboko zasijeca u obiteljske odnose, ispisujući stranicu za stranicom potresne i divne solilokvije o tome što znači biti žena, majka i sestra.	pozitivno
"Bez pretenzija da zvuči politički ili aktivistički, Lombardo je napisala sočno feminističko štivo u kojem je zahvatila višeslojno žensko iskustvo: pišući, između ostalog, o majkama koje ne žele svoju djecu, a najviše ih vole dok spavaju, o sestrama koje jedna na drugoj prakticiraju zlobu i povremeno se guše od ljubomore, validirala je sve naše ženske ""nedopuštene"" i mračne osjećaje."	pozitivno
I zbog toga je čudo, jer je imala samo dvadeset šest godina kad je počela pisati roman: većina raskoši i boli ženskih emocija i ženskih iskustava u toj joj je dobi, po prirodi stvari, bila nedostupna.	neutralno
Vrijeme je priječi da zna kako je to biti majka, žena na pragu pedesetih, supruga koja je u braku četrdeset godina ili odjednom baka.	neutralno
"Morala je, kaže u intervju The New York Timesu, naprosto dobro napraviti ""emocionalnu zadaću""."	neutralno
Njezin je rukopis na početku imao više od 800 stranica; mislim da možemo reći da se dobro pripremila.	pozitivno
"Ako vas sve ovo nije privuklo, onda za ""ljenjivce"" još ovo: već u listopadu 2019. godine HBO je otkupio prava za roman, a prema njemu će snimiti seriju koju će producirati Amy Adams i Laura Dern."	pozitivno
"No o čemu ""Najbolja zabava"" ustvari govori? Obiteljska saga počinje vjenčanjem, mladenka je Wendy koja se udaje za bogataša Milesa Eisenberga, pripadnika jedne od trideset najbogatijih obitelji u Chicagu."	neutralno
Na tom će vjenčanju Violet začeti sina kojeg će odmah po rođenju dati na usvajanje (samo ću toliko otkriti od radnje).	neutralno
Kad se šesnaest godina kasnije, naoko niotkuda, pojavi mladi Jonah Bendt, to ni za jednu od sestara Sorenson, a ni za njihove roditelje, neće biti dobar trenutak.	neutralno
Violetina tajna, za koju je znala samo jedna od sestara, ona koja joj je i pomogla da potajno rodi i potajno dade dječaka na usvajanje, prodrmat će poput cunamija čitavu obitelj: pukotine među sestrama postat će otvoreni i zlobni sukobi, a u pitanje će doći sve, i to naglas.	neutralno
Wendy više nije u braku, u međuvremenu je postala ona koja uvijek pobjeđuje kad je riječ o traumi.	neutralno
"Violet, to ""nadureno lice, dijamanti i superiornost"", udana je za Matta koji zarađuje tisuću dolara po satu, ima dva sina, Wyatta i Elija, i ne želi da joj itko ili išta naruši njezin veličanstveni život."	neutralno
Liza od obitelji skriva da je njezin partner Ryan klinički depresivan, a upravo je otkrila da je trudna.	neutralno
"Grace, to zakašnjelo i dragocjeno dijete, zapravo jedina koju su roditelji planirali, živi ""pomalo onako kako je zamišljala da žive ubojice: oskudno i u sramoti""."	neutralno
Neželjeno dijete Jonah Bendt ima petnaest godina.	neutralno
Njegovi roditelji posvojitelji poginuli su u automobilskoj nesreći kad je imao četiri godine (tada je ujedno i saznao da je usvojen), potom je promijenio niz udomitelja i na kraju završio u domu za dječake gdje ga je pronašla Hanna i odvela sebi doma.	neutralno
No Hanna i njezina obitelj sada se sele u Južnu Ameriku, a Jonah nema kamo.	neutralno
"Tko će ga od Sorensona – koji sad konačno znaju za ""izgubljenog"" člana obitelji – uzeti k sebi?"	neutralno
Čvrsta narativna linija romana je Jonina aktualna sudbina, a oko njega Lombardo plete pripovjedne rukavce: čitatelja vodi kroz odrasle priče sestara i kronološki otkriva ljubavnu priču njihovih roditelja, Marilyn i Davida.	pozitivno
Marilyn je odrasla uz obudovjelog oca alkoholičara, majka joj je umrla od zatajenja jetre kad joj je bilo petnaest.	neutralno
Davida je upoznala za vrijeme studija engleskog jezika koji je prekinula nakon što se udala za njega i ostala prvi put trudna.	neutralno
David je liječnik obiteljske medicine, njegova je majka pak preminula od limfoma kada je imao pet godina.	neutralno
"Pogledaj nas dvoje, kaže mu na prvom spoju Marilyn, ""koliki emocionalni teret nosimo sa sobom."""	neutralno
Dvoje djece bez majki; dvoje mladih, zbunjenih ljudi koji su se nekako dogodili jedno drugome.	neutralno
Neobičan je to osjećaj za dijete, kao da si ti odgovoran za sreću svojih roditelja, nastavlja Marilyn, objašnjavajući mu kakav je to osjećaj biti kći svojih roditelja.	neutralno
"Ne toliko da si uzrok toga, koliko da postoji određena obaveza s tvoje strane da je osiguraš.
Sve donedavno nisam uviđala da to nije normalno."	neutralno
To će dvoje mladih ljudi, bez da naglas izgovore zakletvu, postati sasvim drugačiji roditelji.	neutralno
"Oboje su bili podjednako, agresivno strastveni oko nesavršenosti svoga braka i možda su upravo zato uspjeli postati dvoje ljudi ""koji su zračili većom ljubavlju nego što bi svemir uopće odobrio""."	neutralno
Brak je, brzo je shvatila Marilyn, bio ugodna igra moći, pažljiva ravnoteža sukobljenih ega, suprotstavljenih raspoloženja.	neutralno
"Gasila je svoj kako bi zablistao njegov.
Očuvanje.
Uzajamnost.
Smjela je osjećati samopouzdanje i ushit jedino kada bi on osjećao tjeskobu i pesimizam.
Ako se on oko nečega brinuo, ona se nije smjela brinuti ni oko čega."	neutralno
I nakon četrdeset godina braka njihov je odnos čudo.	neutralno
Još se međusobno nasmijavaju.	neutralno
Toliko često vode ljubav – i u šezdesetima! – da su neiscrpni izvor zavisti, zgražanja i podsmijeha svojim kćerima.	neutralno
"Kad Jonah prvi put dođe u obiteljsku kuću Sorensona, ""na vratima su se pojavili David i Marilyn, držeći se za ruke poput onih sjebanih blizanki iz Isijavanja, a između njih stajao je crni pas veličine konja""."	neutralno
David beskrajno voli svoje kćeri.	neutralno
No Marilyn voli više.	neutralno
I sve one to znaju.	neutralno
Svaka je obitelj nesretna na svoj način, no što ćemo s obiteljima koje su sretne? Konkretno, što ćemo s roditeljima koji su sretni, i dobri roditelji, a ipak proizvode nesretnu djecu? Plamteća ljubav roditelja, brzo postaje jasno, jedan je od glavnih izvora frustracija kćerima.	neutralno
Sve smo mi emocionalno zakočene jer se ti i tata volite više nego što volite nas, Wendy je jednom rekla Marilyn.	neutralno
Sve mi očajnički želimo tvoj život, drugi put je rekla Liza.	neutralno
"I znamo da ga nikad nećemo imati. Majka je, naravno, laka meta, a sve njezine kćeri upravo žive na ""vrhuncu sebičnosti""."	neutralno
