Bilo je potrebno da majka, rođena u podređenom miljeu iz kojeg je željela pobjeći, postane povijest, da bih se ja osjećala manje osamljenom i lažnom u povlaštenom svijetu riječi i ideja u koji sam, u skladu s njezinom željom, stupila.	neutralno
Majka o kojoj piše Annie Ernaux njezina je majka, ali i moja: dijelom majka, dijelom baka.	neutralno
Jedna žena može se čitati kao historiografska studija slučaja, može se čitati i kao posveta običnoj ženi radnici (naspram ikonografiji uspjeha: recimo, iritantno popularnim biografijama poduzetnika, političara, proizvođača mobilnih telefona i privatnih letača u svemir...), a može se čitati i kao intiman dnevnik jednog odnosa koji ni po čemu nije poseban i originalan, jer se ponavlja tisućama godina, ali i dalje, tako običan, nastavlja graditi ovaj svijet.	pozitivno
Gubitak tog odnosa uvijek je istinska tragedija.	neutralno
Vazmi lapis! kao da je čuje kako joj govori.	neutralno
Uzmi olovku! Jednom davno tako bi baba rekla prije nego što bi krenula sa svojom pričom o El Shattu.	neutralno
Mala Padretovica, Nela, uzela bi teku, staru dječju bilježnicu koju je vukla na ljetovanja i nazad na kontinent, pa bi pisala sve što baba govori.	neutralno
Živi u Splitu s majkom, svako ljeto dolazi babi u Velu Luku.	neutralno
Svi stariji Padretovići napamet znaju priču o babinom putovanju u zbjeg u Egipat za vrijeme Drugog svjetskog rata: o devama i pustinji, ukusnim datuljama koje je tamo prvi put probala, o velikom, šporkom brodu, striganju do golega, ferati, Ingležima i Črnima, šatorima, ghibliju i pržini.	neutralno
No ovo nije ta priča.	neutralno
Baba je mrtva, umrla je u kolovozu, u ljeto 1990., dolazi još samo u snovima, nekoliko puta godišnje.	neutralno
Ona, Nela – istodobno i pripovjedačica i tema – sjedi odrasla, glava joj je u mraku, a ruke su na svjetlu.	neutralno
Nije to, piše, pjesnička figura.	neutralno
U sobi je polumrak, svjetlo lampe osvjetljava tipkovnicu i njezine prste.	neutralno
Nesigurni su i zapliću se, ispisuju pogrešna slova i riječi: stalno se vraća i mijenja utipkano.	negativno
"Strah od napisanog je prevelik, ""sve treba dobro prokuhati, dok sva voda ispari i učini se šug, gust i primamljiv""."	neutralno
Još samo malo i više neće ostati ništa, samo ono čega se ne smije sjetiti.	neutralno
Pred nama sjedi pripovjedačica koji ispunjava zavjet babi i sebi.	neutralno
Lapis će je, nada se, spasiti.	neutralno
Moja dota Nore Verde, što je pseudonim Antonele Marušić (ne razotkrivam identitet, tako je potpisana i na klapnama knjige), drugi je njezin roman, a peta knjiga, što donosi zrelog pisca.	neutralno
"Nazivam je piscem, a ne spisateljicom ne zato što želim poništiti rodne uloge ili pravo spisateljice ne samoodređenje: dojadilo mi je muško zapasavanje prostora književnosti, u kojem je pisac priznanje, a spisateljica ""žensko pismo""."	neutralno
U ovom je romanu ustao pisac, ispod stola u tinelu, pod kojim se skrivao od batina i boli, igrom slučaja djevojčica koja je sebi, jednom davno, obećala da će pisati i pokazati im.	neutralno
Dok je kao mala čučala uplakana ispod stola, priviđalo joj se oslobođenje koje će iz tog pisanja doći kad jednom bude za sebe mogla reći da je pisac.	neutralno
I eto pisca!	neutralno
Dota je miraz.	neutralno
U hrvatskom poretku stvari, tradicionalno govoreći, ova djevojčica ima male šanse ostvariti svoje pravo na miraz.	neutralno
"Djevojčica je, ali mašta da je dječak koji je učinio pravu stvar: ""Dobar sam i jak."	neutralno
Bolji od barbe.	neutralno
"I pametniji."""	neutralno
Rastrgana je između ženske i muške rodne ekspresije, jedno ljeto opterećena pisanjem pisma u kojem će, sluti se, otkriti vlastitu seksualnu orijentaciju, no klasične dote nema i zato što odrasta u radničkoj i težačkoj obitelji, natopljena onim što danas nazivamo klasnim sramom.	neutralno
Nisu gladni hrane, ali su gladni svega ostalog, mala sigurno.	pozitivno
U njezinoj se kući knjige ne čitaju, nema ih, s čežnjom i bijesom govori babi o librima koje je vidjela u Splitu kod jedne svoje prijateljice, uporno pita zašto ih i oni nemaju.	pozitivno
"Njezini doma imaju u dnevni boravak puno libri.
Svakakvih, debelih i tankih, onih nikih što su učinjene izvanka od kafene kože."	pozitivno
Dota pripovjedačice druge je vrste: buka i bijes, barbine batine od sedme godine života kad je prvi put istuče, do odraslosti i sna koji se ponavlja jednom mjesečno već dvadeset godina – proganja je muškarac u staroj, babinoj kući, krupan je i ljutit, sad će je početi tući.	neutralno
Prva slika u romanu je nasilje, perpetuira se kroz priču uporno, poput maligne bolesti, no autorica ga balansira kontrapunktom – babinom ljubavlju i nježnošću.	neutralno
Moja dota vješto je iskrojena: ne samo na površini, nego i duboko unutra, to je gotovo idilična priča o ljubavi babe i djeteta što zajedno provode ljeta do njezina polaska u srednju školu.	neutralno
Kroz taj meki pokrov nevinosti djetinjstva nenametljivo, ali uporno probija stvarnost: radnički, a ne građanski status; baba koja nikad neće postati gospođa; barba (ujak) koji tuče nju, ali ne i svoju djecu; majka koju djevojčica ne uspijeva zavesti svojim duhovitim pričama jer pada s nogu od umora; otac kojeg se djevojčica srami jer mu treba socijalna pomoć.	neutralno
Mala se ne odvaja od babe, babin je prirepak, napušta je tek rijetko, kad s dječacima igra nogomet ili odlazi na kupanje.	neutralno
Dani su im ispunjeni kućanskim poslovima, odlaskom u bašćinu (imanje u polju), radom u vrtlu, pjesmom i pričanjem priča.	neutralno
Baba je kao knjiga, samo što je umisto slova njen glas.	neutralno
"Kad se vraćaju iz polja, baba pjeva iz sveg glasa: mogla je postati pjevačica, kao mlada je zapela za uho zborovođi iz Splita, ali otac joj nije dopustio, ""jerbo da imamo puno bašćine i da va da svi fatigamo""."	negativno
"Poslije je htjela biti šarturica, krojačica, ""ni to mi nisu hotili dat, nego muči, ne sviri, hodi u poje po cili dan, po dažju i vitru""."	neutralno
Kratko je vrijeme, kao mlada cura, radila u pučkoj kuhinji u Splitu, baba se nagledala gladnih i bolesnih, tuča oko pijata fažola ili pure.	neutralno
Majka pripovjedačice pak radi kao konobarica u restoranu.	neutralno
Dok je u Splitu, djevojčica je popodne i navečer uglavnom sama, uspije zaspati tek kad se majka oko ponoći vrati kući.	negativno
Zato voli biti s babom.	pozitivno
"Zašto ne može bit obrnuto: da ja živim s njom, a da u Split dolazim nekoliko puta na godinu.
A onda bi mater ostala sama, bilo bi joj grubo.
Ali možda bi onda ona mogla lipo nać drugog muža pa ne bi više bila sama, a meni bi bilo lipo s babom."	neutralno
Na poleđini romana, u blurbu, spominje se kako je roman Nore Verde na tragu Annie Ernaux i Édouarda Louisa.	neutralno
"Usporedbe stoje jer ""Moja dota"" doista u snažnim zamasima govori o borbi jedne obitelji za bolje mjesto u životu kroz neimaštinu, ratove, manjak obrazovanja; govori o ""klasnoj borbi"" koja u stvarnosti uopće nije borba jer se iz vlastite klase i danas teško može izmaknuti."	neutralno
Majka i baba, barba, ujaci što su otišli u Australiju – sve su to težaci i radnici koji nisu uspjeli dohvatiti obrazovanje, biblioteke i libre.	neutralno
"No iako su zamasi takvog pripovijedanja snažni, iako iz idile uporno probija mulj nasilja i siromaštva, atmosfera ""Moje dote"" mnogo više priziva ""Knjigu o ljetu"" Tove Jansson, priču o jednoj djevojčici i jednoj baki koje provode ljeto zajedno na pustom otočiću nakon što je djevojčici umrla majka."	neutralno
"U ""Knjizi o ljetu"" nema grandioznih avantura, tek niz svakodnevnih situacija, rituala i razgovora koji pokazuju da je život sam avantura koju treba preživjeti, i da nas otoci mogu štošta o tome naučiti."	neutralno
"U ""Mojoj doti"" slojeve mraka s kojima će se pripovjedačica boriti u drugim knjigama – kad odraste – ovdje uporno pobjeđuje Slava, inspirirana Vjekoslavom Dragojević Padre, koja nije uspjela postati ni pjevačica, ni šarturica, a ni kuharica, ali je postala najbolja baba na cilom svitu."	neutralno
U smirivanju sjena, u stalnoj proizvodnji mekoće, pomaže otočki dijalekt, luški.	neutralno
Autorica na kraju romana prilaže kratki glosar u kojem doznajemo da su, na primjer, bagaji prtljaga, frementun kukuruz, imberlan je onaj koji je lud, trknut, malo munjen, lapis je, već znamo, olovka, setemana tjedan, a turčin prostorija za kuhanje i pečenje s kaminom.	neutralno
Glosar ne obuhvaća sve izraze koje autorica koristi, ali čitatelj može lako pratiti govor likova čak i ako je dublje s kontinenta.	neutralno
I kad ne razumije izraz, jasan je kontekst, ono u što ne uspije prodrijeti s razumijevanjem, neka ostane misterij: i idiomi mogu poslužiti kao funkcionalne praznine u koje čitatelj ima pravo upisati vlastiti kod.	neutralno
Raskošan luški dijalekt doprinosi filmičnosti ovoga romana.	neutralno
Moja dota napisana je u kratkim poglavljima koja funkcioniraju poput trodimenzionalnih slika: od početka je jasno da je u pitanju autofikcija, autorica to potvrđuje posvetom na kraju knjige svojoj otočkoj ženskoj familiji, no šavovi koji spajaju autobiografsko s književnim toliko su vješto izvedeni – jedna je u familiji ipak uspjela postati (književna) šarturica – da se čitatelju čini kao da gleda film.	neutralno
Književni postupak besprijekorno je izveden: priča zarobi od prve rečenice; intimno je dirljivo, ali istodobno i univerzalno.	neutralno
"Iako je ""Moja dota"" zaokružena cjelina, dojam je kako bi iz nje moglo izrasti još romana."	neutralno
Neka pitanja, očito namjerno, ostaju neodgovorena.	neutralno
To nimalo ne smeta čitanju, jer jasno je da je ovo priča o babi – kompozicijski sve se vrti oko nje i pripovjedačica joj se uvijek vraća, u koju god digresiju skrenula.	neutralno
No digresije su intrigantne, mračne, i čitatelj priželjkuje da autorica i u njih usmjeri lapis.	neutralno
S obzirom da je svoju pripovjedačicu ostavila u četrnaestoj godini, na pragu polaska u srednju školu, za koju se mala pripremila, ne boji se, prostora za daljnje pisanje ima.	neutralno
Te intrige-digresije uglavnom se tiču muškaraca: izmaknutog oca i barbe, osobito porijekla njegova nasilja koje uporno usmjerava na dijete.	neutralno
"Barba može sam izist cilo kilo srdela pečenih na gradele.
Pravi se važan s tim, kao da je narodni heroj.
On puno fatiga i zato smi puno i jist.
Najvažnije je da njemu ništa ne fali.
I da je parićano kako bog zapovida.
Ali ne zapovida bog, nego barba.
To onda oće reć da je barba ustvari bog.
Kad ja i baba svaku noć molimo 'budi volja tvoja', to onda molimo barbu da bude volja njegova.
Ako je barba stvarno taj bog, onda ja više neću molit, samo ću činit fintu.
Ka da će baba skužit."	neutralno
Djevojčica razmišlja o tome zašto je barba toliko mrzi i zašto je nikad ne pohvali kada vidi da je nešto dobro napravila.	neutralno
Godinama je s njim vodila rovovsku bitku: ona naoružana riječima, on golom silom.	neutralno
"Uvijek je pobjeđivao, ali nikada do kraja, stalno se morao vraćati i iznova udarati.
Izgledalo je kao da nikada nije završio posao."	neutralno
Taj nedovršeni posao u odrasloj dobi promeće se u noćne more – nasilje međutim nije sasvim potisnuto u nesvjesno, to znamo iz drugih autoričnih knjiga, uostalom i iz njezina novinarskog angažmana na portalu VoxFeminae.	neutralno
Pri kraju romana, djevojčica sve glasnije mašta o bijegu.	neutralno
"Kad narastem moram pobić od ovih ljudi.
Nije mi jasno kako sam se ja među njima rodila, nekad ni njima to nije jasno, pa se svi skupa čudimo."	pozitivno
Idilično prerasta u tegobno, tek u nagovještajima slutimo Drugoga, onoga koji se rađa da ne bude prihvaćen: majka i baba borile su se za golu egzistenciju, između ostaloga i zato da bi kći i unuka dobila i obrazovanje i libre, na njoj je sada bitka druge generacije – još je tu neimaština i klasna borba, ali i sasvim novi, rodni i seksualni, majci i babi nezamislivi prostori slobode.	pozitivno
O tome Nora Verde u ovom romanu ne piše – i nije ni trebala – ali se nadam da je to ostavila za idući.	neutralno
Pripovjedač se budi u bolnici: ne zna tko je, što je, gdje je, ni o čemu se radi.	pozitivno
Ne sjeća se kad je legao spavati ni što je radio prije toga, ničega se ne sjeća, ne postoji prije, nikakva prošlost.	negativno
Budi se u užasu, ili ga užas budi, preplavljen je egzistencijalnom strepnjom.	negativno
Ne znam jesu li vam takvi trenuci poznati; to je onaj trenutak kad se probudite gledajući u prazninu.	neutralno
A ona gleda vas.	neutralno
Dok leži u bolnici, možda zbog nedostatka kisika, pričinjavaju mu se stvari: uvečer je, tonući u san, počeo viđati orlove.	neutralno
Goleme ptice okupljale su se iznad njegova kreveta, u prostoru koji više nije bio omeđen stropom i zidovima.	neutralno
Osim orlova, pričinjava mu se i glazba.	neutralno
Dolazi iz daljine, vrlo tiha, svečana, melankolična melodija, jasno je čuo harfu i vrlo suzdržana puhaća glazbala.	neutralno
Možda je to halucinacija, ali možda je to i glazba sfera.	neutralno
Za glazbu je pitao medicinsku sestru, ali kad ga je čudno pogledala, shvatio je da je orkestar u njegovoj glavi.	neutralno
Ptice nije spominjao.	neutralno
Tako počinje novi, kratki roman Ede Popovića, knjiga od svega 142 stranice, podijeljena u tri dijela – Buđenje, Povlačenje i Prekid – i nabijena slojevima kao kineska kutija.	neutralno
Pripovjedač uskoro doznaje da je u bolnici završio zbog embolije.	neutralno
Kronična opstruktivna bolest pluća od koje boluje godinama i ugrušci u plućima pretvorili su njegovo tijelo u skladište ugljičnog dioksida.	neutralno
Rutinskom pretragom otkriven mu je i limfom u zdjelici.	neutralno
Ugrušci u plućima, ispalo je, manji su problem.	neutralno
Treba preživjeti prvi udar, što mu je uspjelo, ostalo će riješiti tablete.	pozitivno
Zbog limfoma kreće na kemoterapiju.	neutralno
Godina je 2020. i usred pandemije koronavirusa pripovjedač se bori za život, za dah.	neutralno
Nazivam ga pripovjedačem, iako bih ga mogla nazvati i Edom Popovićem, piscem, suprugom i ocem, s obzirom da u romanu spominje ženu Lilu i sina Svena, sustanare mačke i psa nazvanog Kodo kojem je prošloga ljeta preko društvenih mreža tražio udomitelja jer se zbog piščeve bolesti obitelj o njemu više nije mogla kvalitetno brinuti.	neutralno
Ne ustežem se ukazati na autobiografsku poveznicu iz obzira, uostalom ni sam autor ne skriva da je građu za ovaj roman crpio iz vlastita života, činim to zato što vjerujem da je važno naglasiti razdjelnu crtu između života i književnosti.	neutralno
Ovoga puta ne stoga što čitatelji književnost vole čitati kao trač rubriku, pa u život upisuju romane, nego zato što je u pitanju odlična književnost pa je važno naglasiti – pisca.	neutralno
Paradoksalno, pisca koji se ne skriva iza fikcije.	neutralno
Kako sam brojio ružičaste robote (Naklada OceanMore, 2021.) fragmentarna je proza, kombinacija romana, autobiografskih činjenica, dnevničkih zapisa, mikro-eseja i poetskih posveta ljepoti svijeta – onog vani i onog unutra.	neutralno
"Ružičasti roboti iz naslova romana ujedno su roboti iz naslova pjesme Flaming Lipsa ""Yoshimi Battles th Pink Robots""."	neutralno
U toj pjesmi, koju je čuo iz sinovljeve sobe u trenutku kad je doznao za dijagnozu limfoma, za pripovjedača ima nešto vrlo umirujuće i opuštajuće.	neutralno
"Prijateljica Christine, nakon što joj piše o Yoshiminoj borbi s ružičastim robotima i svojem limfomu, savjetuje mu da, po uzoru na dječju priču ""Jim Knopf i Lukas strojovođa"", prebroji svoje robote, kao što je Jim prebrojio divlje pirate pa su postali toliko smušeni da više nisu mogli biti opaki i zločesti."	neutralno
Jim se, naime, borio s Divljom trinaestoricom, no kad ih je prebrojio, ispostavilo se da ih je samo dvanaest.	neutralno
"Dakle: nastavi brojiti svoje robote.
Moguće je da se prave da ih je više nego što ih ima.
Kad ih jednom uvjeriš da ih je manje, svi će postati dobroćudni."	neutralno
Prijatelj Neven, učitelj aikida, u miru sa sobom i s čitavim svijetom, pripovjedaču pak govori da je bolest privremeno stanje, podsjetnik na to odakle dolazimo i kamo idemo.	neutralno
Kemoterapija ga, dodaje, može izliječiti ili ubiti, ovisno o tome kako gleda na nju.	neutralno
Samo se nemoj uplašiti, savjetuje mu, jer strah je ubio oboljele od mnogo lakših bolesti nego što je ova tvoja.	neutralno
"Čitajući pak ""Silent Spring"", knjigu Rachel Carson – što govori o ekologiju unutar naših tijela i o tome kako promjena čak i u jednoj molekuli može utjecati na cijeli sustav i izazvati promjene u organima i tkivima koji prividno nisu povezani s točkom promjene – pripovjedač zaključuje kako mu ne preostaje ništa drugo nego preuzeti stvar u svoje ruke i pokušati odgonetnuti gdje je to, u kojem dijelu tijela naime, i kada, pretrpio udarac, ili tu sićušnu promjenu, što je pokrenulo bolest."	neutralno
Redovi koje zapisuje – roman – dio su te potrage.	neutralno
Počinje, dakle, s bolnicom.	neutralno
Probudio se na mjestu na kojem se umire.	neutralno
Ali onda se tu i rađa, zaključuje.	neutralno
Postoji li uopće mjesto gdje se ne umire i ne rađa? Mjesto gdje nema ničega, neko ne-mjesto? Pomisao na to uznemirila ga je više nego stanje u kojem se nalazio.	neutralno
Ljudski mozak ne može zamisliti ništavilo, ne beskrajnost praznog prostora, kako pogrešno opisuju ništavilo, nego upravo suprotno – odsutnost prostora, materije, oblika, ičega, ono što je, kažu, prethodilo velikom prasku. Ipak, uznemirila ga je pomisao na to nezamislivo ništavilo.	neutralno
Ne zna zašto ga je to uznemirilo, uostalom nije ni važno, važno je da jalovo razmišlja o nezamislivoj stvari, koja ga k tomu uznemiruje i plaši.	neutralno
"A da to nezamislivo ništavilo, pomislio sam, to ne-mjesto, nije ono iz čega sam se probudio u ovom krevetu, u ovom kavezu?
Da to nije sȃma smrt? Bio sam umro, ali su me vratili iz mrtvih.
Sinulo mi je da užas koji sam tada osjetio nije bio izazvan mjestom na kojem sam se probudio, već mjestom iz kojeg sam se probudio.
Otuda ovaj strah."	neutralno
Blizina smrti neminovno priziva sve prijašnje smrti s kojima smo se susreli pa se pripovjedač tako prisjeća majke koja je umrla prije osam godina.	neutralno
Mnogo se puta, kaže, susreo sa strahom, no nikad nije toliko strahovao kao što je posljednjih godina majčina života strahovao za nju.	neutralno
Nije bila u godinama za umiranje, no bolovala je od ALS-a, bolesti koja joj je oduzela najprije govor, pa gutanje, potom se obrušila na hodanje, a na kraju joj je uzela i disanje.	neutralno
Pripovjedač se tad prvi put susreo i s respiratorom za kućnu upotrebu koji su nabavili majci; to joj je kupilo još tri mjeseca života.	neutralno
"Strašan je taj osjećaj bespomoćnosti koji vas pritišće, lomi, tjera da se tresete, cvilite i plačete.
Kroz majčinu bolest svi smo se u obitelji suočili s tim osjećajem.
Borite se s nečim bez ikakve šanse za uspjehom.
A njezina je bolest upravo takva.
Što god poduzeli, koliko god se trudili i upinjali, osuđeni ste na neuspjeh.
To nas je ponekad jako obeshrabrivalo i onda smo to pokazivali jedni drugima, ali ne i majci.
Ona je znala punu istinu o svojoj bolesti, ništa joj nismo zatajili ni mi ni liječnici, laž je strašnija od ikakve bolesti, no vlastitu nemoć i obeshrabrenost smo joj zatajili."	neutralno
"Spomen respiratora i gubljenja daha, gušenje uslijed gubitka sposobnosti disanja, ""Ružičaste robote"" neminovno sidri u stvarnost."	neutralno
Oboljeli od KOBP-a visoko su rizični u doba pandemije, pripovjedač ne smije van, sin za doručkom nosi masku, tako čuva oca.	neutralno
"Dogovorili smo se da se nećemo ustrtariti, da nećemo dopustiti virusu da nas zatoči, sputa i zarazi strahom.
Život u strahu i nije neki život.
Ipak, ne idem u trgovine, njih dvoje mi to ne dopuštaju.
Budem doma, pišem, čitam, prošećem se po kvartu, vikendom Lila i ja odemo negdje u šumu.
Ne nedostaju mi prijatelji, znanci, drugi ljudi, dovoljno je da znam da su ondje vani.
Nedostaju mi, međutim, Lilini i Svenovi dodiri i poljupci.
Ljubljiva smo obitelj.
Ljubimo se i grlimo u svakoj prilici.
Tako je bilo prije.
Tu nas je virus pokolebao, postavio zavjesu između nas. I kako počnemo cijeniti nešto tek kad to izgubimo, nastavlja, shvatimo da smo, dodirujući se, zapravo potvrđivali da smo živi, da smo tako slavili život."	neutralno
Da se ne možemo u potpunosti osjetiti živima bez dodira drugoga živog.	neutralno
Umjesto vani, pripovjedačev život odvija se u glavi i na balkonu.	neutralno
Tih dana češće nego inače kopa po prtljazi što se cijelog života gomilala u njegovoj glavi.	neutralno
Nezahvalan je to i neugodan posao.	neutralno
I ova jedna koža mu je previše, uvijek mu je bila previše, podsjeća ga na to da je u njoj zatvoreno ono što su izdresirali da bude ja.	neutralno
Osjeća da će, uspije li se riješiti te kože, otkriti onoga koji ga diše, pokreće, živi.	neutralno
"Često sam se pitao iz čega raste čovjek, tko je doista onaj tko me raste, tko mi izgrađuje pluća, srce, mozak, oči, mišiće, kosti, sve.
Sigurno to nije neki bog, još manje onaj kojeg su drilali da bude ja – onaj koji misli, koji ima potrebe, koji čita i piše, koji radi, privređuje i zadovoljava potrebe.
Dakle, onaj koji se bavi tričarijama.
I koji ne može reći, evo, sad ću učiniti da ti raste kosa, da ti srce kuca i krv kola tijelom, da se rastvori hrana koju jedeš i njome se nahrani svaka stanica, da vidiš ono stablo, da čuješ zvukove iz susjedne zgrade, da osjetiš miris crnog čaja.
Ništa od toga ne može onaj u meni za kojeg su me uvjerili da sam ja, nego to čini onaj u meni kojeg ne znam, a osjećam i trebam ga upoznati."	neutralno
Pripovjedač i njegova obitelj stanuju u zgradi, nakon jedne kemoterapije čuje nekoga na susjednom balkonu, dijeli ih tek pregrada od mutnog, armiranog stakla.	neutralno
Nepoznati ne želi odgovoriti kako se zove, pripovjedač mu nadijeva ime Sjena i s njim, u mjesecima koji slijede, redovito razgovara.	neutralno
Sjena možda doista postoji, ima ime, za život privređuje prevarantskim poslićima, no Sjena je možda i pripovjedačev zamišljaj, možda je to ona druga polovica bića koja je bila nepoznata (i nepriznata).	neutralno
Sjena je moguće i jedva vidljiva materijalizacija straha koji pripovjedač često osjeća.	neutralno
"Ne mogu od njega pobjeći, borba s njim je uzaludna, ne pomaže ako ga poričem.
Zato sam ga pustio da me prožme, pomirio se s njim.
Prihvatio sam ga kao što prihvaćam nenadani nestanak struje, ispuhanu gumu na autu, žvaku na potplatu cipele.
Sad smo u dobrim odnosima, strah i ja.
Kad dođe, pustim da me zagrli, zagrlim ja njega, neko vrijeme se grlimo, i onda on ode."	neutralno
Razgovara s Lilom koja taj zapis pročita u njegovoj bilježnici.	neutralno
Čega se boji? pita ga.	neutralno
Boji li se smrti? Naravno da se boji smrti, odgovara joj.	neutralno
On toliko voli život da bi radije umro, nego ga se odrekao.	neutralno
Ljetos je bio na rubu, jedva se izvukao.	neutralno
"Ljetos sam, govori Lili, ""sjećaš se, plakao kad smo razgovarali o tome, a sad, vidiš, mirno žvačem rižoto i salatu."	neutralno
Pričao sam ti kako sam ponekad noću bezglasno plakao gore u bolnici.	neutralno
Nisam želio da me drugi čuju.	neutralno
"Bilo je to iz čistog očaja."""	neutralno
"Roman ""Kako sam brojio ružičaste robote"" rijetko je iskrena proza, nema se prilike često ovako nešto čitati u hrvatskoj književnosti, osobito iz muške vizure."	neutralno
"Zapisi su to ranjivog i ranjenog muškarca što se bori za život i dah, vrlo emocionalni, ali nimalo melankolični ili patetični: ovo je pošteno svođenje računa sa životom, ispovijest ""gubitnika"" u svijetu natjecatelja, sirovo i neuljepšano; gola, otkrivena rana koja pred našim očima, nadam se, zacjeljuje."	neutralno
"Ovu vrstu prozu imam običaj nazivati ""romanima ni o čemu""."	neutralno
Kvalifikacija nije mišljena pejorativno, više upućuje na pisca koji se hrabro odrekao uobičajenih književnih alata.	neutralno
Hrabro, jer književni su alati često štake, dimna zavjesa, koji ponekad skrivaju nedostatak talenta, a nerijetko i nedostatak smisla.	neutralno
Ružičasti roboti roman su ni o čemu jer nemaju klasičnu radnju i zaplet na koje se čitatelj navikao oslanjati.	neutralno
Umjesto toga su roman o svačemu (bitnom).	neutralno
Vrsta je to proze koja počiva na promišljenom meandriranju, dubokom zagledavanju u samoga sebe; ne slijedi zakone bilo kojeg žanra, vrste, forme ili stila, a najčešće nema ni jasan završetak.	neutralno
Ne može ga ni imati, jer ova priča još traje, i trajat će dok ima pripovjedača i pisca.	neutralno
"Za razliku od autofikcije, zadnjih godina popularnog ""žanra"" u kojem se čitatelj nerijetko spotiče o piščev ego, pisac je u ""Ružičastim robotima"" slabo prisutan."	neutralno
Opet paradoksalno, jer piše o sebi, no ovdje se malo toga fikcionalizira, stvarnost se zapisuje kako se događa, no ta stvarnosna, autobiografska priča ipak prolazi žrvanj piščeve djelatnosti – sam pisac, promatrajući i zapisujući svoj život, pretvara se u prizmu što stvarnost reflektira u književnost.	neutralno
