Doslovce sam bila u bolnici i rađala dijete kad mi je suprug rekao: 'Prodaja Atlasovih šest zbilja je skočila!	neutralno
"Kasnije tog dana netko joj je na Tumblr poslao poruku: ""Hej, znaš li da je tvoja knjiga postala viralna na TikToku?"""	neutralno
Olivie Blake nije uopće imala profil na TikToku, nije znala o čemu joj govore.	neutralno
U međuvremenu, netko je kreirao hasgtag #theatlassix i zajednica BookTokera je uskoro brujala: korisnici su raspravljali o romanu, snimali video-klipove u kojima su hvalili knjigu, dijelili ilustracije koje je za roman napravila autoričina prijateljica Little Chmura.	neutralno
Vrlo brzo, hashtag je imao više od 20 milijuna pregleda!	neutralno
A onda se dogodila prava čarolija.	neutralno
"Viralna slava rezultirala je time da su Blake počele opsjedati nakladničke kuće, čak sedam najvećih borilo se za prava, i ponudile joj da će objaviti tiskanu knjigu – u ožujku 2022. godine ""Atlasovih šest"" objavila je nakladnička kuća Tor Books, a krajem listopada prošle godine izišao je i drugi nastavak trilogije, ""The Atlas Paradox"" (treći, ""The Atlas Complex"", najavljen je za 1. rujna 2024. godine, a već se može kupiti u pretprodaji za 28,99 dolara)."	neutralno
U međuvremenu, Olivie Blake potpisala je i ugovor s Amazon Studios koji će prema njezinoj trilogiji snimiti seriju.	neutralno
"U trenutku kad je prvi put, sama, objavila ""Atlasovih šest"", žanr dark academije još nije bio toliko popularan."	neutralno
Blake ga, kako je rekla u jednom razgovoru, shvaća kao podžanr trilera.	neutralno
Ona je pak htjela napisati psihološki triler koji je smješten u magično okruženje.	neutralno
Željela je stvoriti klaustrofobičnu atmosferu, poput one u razredu, i u kojoj je vrlo lako zaboraviti da naša djela imaju posljedice, što znači da i likovi vrlo lako mogu promijeniti svoja etička načela.	neutralno
Upravo to vas čeka u romanu koji je na hrvatski prevela Lidija Toman za nakladničku kuću Znanje.	pozitivno
Zaplet počinje tako što šestero mladih, iznimnih ljudi – na pragu dvadesetih ili u dvadesetima – dobije poziv koji ne mogu odbiti.	neutralno
Nico de Varona i Libby Rhodes, zakleti neprijatelji s fakulteta, oboje su iznimno talentirani fizičari.	neutralno
Reina Mori je naturalistkinja, Callum Nova empat koji može manipulirati masama, Parisa Kamali zavodljiva telepatkinja, a Tristan Caine je iluzionist koji može prozreti svaku laž.	neutralno
Svi oni su medejci, izrazito talentirani čarobnjaci koji redovito dobivaju poziv da studiraju na nekom od medejskih sveučilišta, no ovih šestero je doista iznimno – da požele, mogli bi spasiti ili uništiti cijeli svijet.	neutralno
Njima će pristupiti tajanstveni Atlas Blakely i ponuditi im da pristupe Aleksandrijskom društvu koje u svojem arhivu čuva davno izgubljena znanja.	neutralno
No postoji uvjet: najprije moraju proći inicijaciju koja će trajati godinu dana.	neutralno
A nakon godinu dana, od njih šestero, pet će ih biti primljeno u elitno društvo.	neutralno
Atlasovih šest štivo je za starije adolescente prema punoljetnima: u romanu ima opisa seksa, čak i jedan threesome, iako su prizori zapravo vrlo nevini.	neutralno
No svi su likovi, kako kaže sama autorica, sto posto seksualno fluidni: s jedne strane zato što je autorica svjesna današnje potrebe za različitim, i slobodnim, seksualnim i rodnim identitetima, no mnogo više iz želje da se likovi uopće ne moraju seksualno čvrsto označiti – jer je onda doista važna njihova osobnost.	neutralno
"Atlasovih šest vremenski pokriva pripremnu godinu do inicijacije, u kojoj šestero odabranih, uvjetno rečeno, ""rješava zadatke"", no potajice pokušavaju razotkriti i tajnu Aleksandrijskog arhiva i dobiti odgovor na pitanje tko je Atlas Blakely."	neutralno
U tom dijelu zapleta autorica se podosta muči (zaplela se oko ideje i prirode vremena u kvantnoj fizici, te motivacije, uvjetno rečeno, glavnih negativaca…) pa bi zahtjevniji čitatelji – navikli na složene i besprijekorno izvedene glavne i sporedne narativne linije u fantastičkim serijalima – mogli biti razočarani.	negativno
"Pored toga, trilogija Olivie Blake (pročitala sam i drugi dio, ""The Atlas Paradox"", koji se može kupiti u knjižarama Znanja na engleskom jeziku), ne funkcionira po principu nekih drugih serijala (primjerice, onoga o Harryju Potteru) u kojem svaki nastavak ima svoj podzaplet pa ih gotovo možete čitati kao samostalne romane."	neutralno
"Kad dođete do kraja ""Atlasovih šest"", nećete dobiti sve odgovore, a nove mamce autorica baca i u drugom nastavku."	neutralno
No, već sam spomenula, čitav žanr dark academije ne polaže veliku pažnju na klasičan zaplet, u smislu akcije.	neutralno
Njegova su specifičnost – ono što doista zanima autore, pa tako i čitatelje – zapravo odnosi među likovima.	neutralno
U tom je dijelu Olivie Blake izvanredna: rijetko se u žanrovskoj literaturi susreće takva psihološka nijansiranost u gradnji karaktera.	neutralno
Svih šestero junaka, uz sporedne – dakle, govorimo o desetak junaka! – punokrvne su osobnosti, koje izmiču površnoj crno-bijeloj karakterizaciji.	negativno
"Uživat ćete u otkrivanju njihovih tajni, magijskim preobrazbama, čarobnjačkim talentima koje otkrivaju kad međusobno surađuju, a posebno u tome što baš svi u jednom trenutku prelaze na ""tamnu stranu"" – ili svijetlu stranu – i odriču se svojih, do jučer čvrstih, etičkih uvjerenja."	pozitivno
Svaki od šestero odabranih pomno je razrađena psihološka studija, a kad se svi nađu na okupu, doslovce se rađa alkemija.	pozitivno
Olivie Blake u jednom intervjuu otkriva kako je, pišući, najviše uživala u tome što svakoga od junaka, tijekom vremena, porazi njegova vlastita psiha.	neutralno
"Kako bi prošli najavljenu inicijaciju, odabrani medejci prisiljeni su sklapati saveze koji, nerijetko, nalikuju ugovoru s vragom, a s obzirom da se međusobno i natječu, ""Atlasovih šest"" pomalo nalikuje ""Gospodaru muha"" smještenom u fantastični svijet."	neutralno
Užarenom klupku odnosa veoma pomažu ilustracije koje se, naravno, nalaze i u hrvatskom izdanju knjige: Little Chmura iznimno je talentirana umjetnica, njezini realistični crteži junaka, u kombinaciji s vizualnom opremom knjige – provučenom s naslovnice na unutarnju stranu korica i početke poglavlja – zazivaju estetiku tarot karata ili drevnih knjiga ukrašenih mističnim simbolima.	pozitivno
Potpuno mi je jasno zašto su BookTook i zajednica dark academije oduševljeni knjigom: neizbježan je učinak nalik gatanju ili barem cosplayingu.	pozitivno
Kad pročitate roman, preostaje samo jedno pitanje: od šestero odabranih, koji ste aleksandrijac vi?  	pozitivno
Nina Wähä (Stockholm, 1979.) švedska je književnica i urednica koja je za ovaj roman dobila niz prestižnih nagrada i njime dospjela na vrh liste najčitanijih naslova u 2020. godini.	neutralno
Na hrvatskom jeziku čitamo ga u izvrsnom prijevodu Sandre Ljubas i izdanju Hene com.O čemu se u njemu radi teško je napisati bez famoznoga “ali”.	pozitivno
Ako kažemo da je tema obitelj, mislim da ćemo najviše biti u pravu.	neutralno
No kakva obitelj i kakvi su događaji ispunili složenu strukturu teksta, pitanje je po sebi dovoljno da nas dovede u nepriliku analize.	neutralno
Mislim da treba početi sa strukturom jer se događaji u romanu naslaguju jedni na druge i mi, čitajući, rekonstruiramo događaje i vremenski slijed pa priča sjeda na mjesto tek u našim glavama; u romanu je ona razbacana u životima protagonista, a to su glavna lica, njih četrnaestero djece i roditelji.	neutralno
Radnja se događa osamdesetih godina prošloga stoljeća na granici Finske i Rusije.	neutralno
Ovaj specifičan prostor bremenit atmosferom sjevernjačke divljine, politički sustavi, rat za teritorij, blizina granice i ljudi koji preživljavaju u tim uvjetima bili bi dovoljan razlog za čitanje jer nam otkrivaju prostor o kojemu znamo malo.	pozitivno
Otkopavanje složenih prilika koje čine karakterističnost nekog ambijenta jedna je od velikih zadaća književnosti.	neutralno
Čitajući, pitala sam se nije li upravo mentalitet sjevernjaka bio poticaj i nit vodilja u zapetljavanju fabule.	neutralno
"Tu se nameće i tema nordijske sage jer roman ""Oporuka"" svojevrsna je saga ili barem slijedi logiku sage."	neutralno
Poglavlja se redaju kroz lica djece i svako se poglavlje bavi životom jednoga od njih.	neutralno
Otac Pentti i majka Siri, njihova kuća, “praprizori doma”, u centru su zbivanja, napose svojim životom, zakrivljenjima karaktera i rastavom.	neutralno
Dinamika mnogočlane disfunkcionalne obitelji, njihova sjećanja, uvjeti odrastanja, njihove različite prirode i događaji koji su ih oblikovali čine da tekst konstantno vibrira i mijenja se.	neutralno
Taman kad pomislimo da smo rekonstruirali neki događaj koji nam je važan, nastupa novi lik i njegov život baca novo svjetlo te se uzajamna ljubav i mržnja između likova umnaža i iščezava, izvori frustracija se pojavljuju kao virovi u tekstu, a mračna atmosfera sjevera drži cijelu stvar na okupu i mi, kao čitatelji, veslamo po tom uzburkanom moru tuđih života i pronalazimo negdje i sebe.	pozitivno
Obruč romana je Annie, najstarija živuća sestra, njezina trudnoća i njezin povratak u kuću iz Stockholma u kojemu živi.	neutralno
Došavši u kuću, koju bih nazvala epicentrom romana, počinje se razvijati neka mukla, barbarska, tjeskobna pa i zvjerska atmosfera koja nas preuzima jer slutimo da je u podlozi cijele priče teror pod krinkom obiteljskog suživota, šutnja i potreba da se progovori.	pozitivno
Annie se pita jesi li netko, ili tek postaneš netko.	neutralno
Ovim se pitanjem vodi razvoj likova koje upoznajemo u vrijeme Božića 1981. godine, ali autorica piše i o vremenu Drugog svjetskog rata te o geopolitičkim prilikama u Kareliji na granici Finske i Rusije, već spomenutom mentalitetu, šutnji, zločinu, atmosferi šuma, usamljenosti, divljini, periferiji, instinktima koji su ljude vodili van iz začaranih krugova djetinjstva.	neutralno
U romanu postoji motiv Kralja štakora i obitelj podsjeća na štakore povezane repovima.	neutralno
Svaki od njih želi ići svojim putem, ali repovi su im uvijek povezani i njihove slobodne putanje nisu moguće.	neutralno
Nitko, naime, ne može tek tako odšetati od prilika kojima je svjedočio.	neutralno
Struktura romana je zapravo ilustrirana tim simbolom.	neutralno
“Zar život ne mora izbiti negdje, ono što šišti u tamnim skrovištima i kutcima kojima ne može vladati, nad kojima nema nadzor.”	neutralno
U romanu postoji pripovjedač, onaj sveznajući, čini mi se da bez njega ovoliko rasutog tereta ne bi moglo biti pospremljeno, a ta misao, da netko sav taj nered koji je nastao stihijom života i prilika želi pospremiti, nas kao čitatelje drži unutra.	pozitivno
Ulazimo u kuću, zajedno s Annie, i počinjemo pospremati.	neutralno
U raščinjavanju značenja postoji jedno pitanje koje je meni, kao čitateljici, bilo najzanimljivije, a to je – koliko traje odgovornost roditelja za živote svoje djece?	pozitivno
Ima li mjeru i granicu ljubav i odgovornost, krivnja i povezanost?	neutralno
Mogu li se i kada roditelji odvezati iz tog čvora koji su proizveli?	neutralno
Kroz ovakva razmišljanja vodi nas Siri, majka: “Ali, možda ni majčina ljubav nije tolika?	neutralno
Možda, kada djeca dođu u određene godine, prestaneš osjećati odgovornost za njih?	neutralno
Koliko je godina dovoljno?”	neutralno
Sirina djeca, živa i neživa, od nje odlaze i njoj se vraćaju pokušavajući artikulirati pitanja i traume koja su ih dovela u stanje u kojemu jesu, ali da ne otkrijem sve, pretpostavljate da će se tu negdje naći i alkohol, preljub, izdaja, žrtva, nesnalaženje, misterij, žrtva i bijeg u slobodu, opreka grad-selo, divljina-civilizacija, ljubav-mržnja, dan-noć, sloboda-ropstvo.	neutralno
Mogla bih iscrpiti sve parametre kojima se gradi napetost, a onda se vratiti na stil autorice koji teške teme drži na okupu suverenim pripovjedačkim ritmom, nježnošću opisa i premrežava tekst spoznajama i pitanjima koja se uključuju i u naše subjektivno poimanje problematike života u specifičnostima naših životnih prilika.	pozitivno
Svaki od četrnaest likova pokušava riješiti probleme iz jedne kuće.	neutralno
"Ako ništa drugo, roman ""Oporuka"" će nam, ako smo zabrinuti zbog svojih života, pokazati da ni drugima nije puno bolje, da savršenost ne postoji i da je život moguć i onda kada nam se čini da su stvari došle do kraja."	pozitivno
"Pripovjedačkim manevrom i autoričinim stilom roman ""Oporuka"", koliko god prokopavao mračne tunele obiteljskih odnosa i specifičnog prostora (autoričini korijeni sežu u prostor Karelije), intimistički je roman, osjećaj da se tekst cijelo vrijeme bavi zapravo nama ne napušta nas, suosjećamo, pratimo, strahujemo i osjećamo na vlastitoj koži svu grubost i nježnost života."	pozitivno
Nije se nikad dogodilo, ali tko nam brani maštati: zamislite da se tamo negdje 1960-ih godina, u vrijeme kad žene masovno ulaze na tržište rada, pojavila televizijska kuharica koja je pet puta tjedno, u mrtvom TV satu (kad se svima spava nakon ručka), žene učila samopoštovanju i, pssst!, feminizmu! Sve je radila krivo.	neutralno
Iz televizijskog studija izbacila je kičaste dekoracije, odbila je čitati budalaštine s blesimetra, nije pristala nositi utegnute haljine niti igrati na kartu seksepila, nikad se nije smiješila, za sponzorske gotove juhe u kameru je rekla da su pune otrova, frustriranim domaćicama dala je par korisnih savjeta o upotrebi otrovnih gljiva, a umjesto snishodljivih savjeta o tome kako zadovoljiti muža i obitelj nedjeljnim ručkom, ženama je davala – lekcije iz kemije.	neutralno
 Čitajte i mijenjate!	neutralno
Tamnoputi američki vojnici u Europi su, neposredno po završetku Drugog svjetskog rata, iskusili nezapamćenu slobodu.	neutralno
Tih četiri godine, koliko je trajala saveznička uprava u Njemačkoj, od 1945. do 1949., crni vojnici u američkoj okupacijskoj zoni – koja je obuhvaćala ugrubo Bavarsku, Hessenu, te sjeverne dijelove Württemberga i Badena – smjeli su se družiti s bijelim ženama i ući u svaki restoran, a da ne naiđu na rasne barijere i diskriminaciju.	neutralno
Bila je to dvostruka pobjeda civiliziranosti: kod kuće su se još morali voziti u stražnjim dijelovima autobusa, a tijekom nacističkog režima, koji su porazili s Rusima, Francuzima i Britancima, smatrali su ih takozvanim majmunolikim podljudima.	neutralno
U poratnim godinama ti su hrabri mladići u Njemačku donijeli jazz i swing, ali i ostavili četiri tisuće tamnoputih beba, poznatih kao brown babies.	neutralno
Taj će isti CDU pedeset godina kasnije dati Angelu Merkel, državnicu za koju Susanne Abel nikad nije glasala, ali joj se u pogovoru romana zahvaljuje na humanim odlukama koje je donijela u ljeto 2015. godine.	neutralno
U tom istom pogovoru Abel piše kako, nakon što je duboko zaronila u životne uvjete Drugog svjetskog rata i njemačkog poraća, zna koliko je sretna što je rođena u doba u kojem barem u Njemačkoj prevladavaju mir, ekonomski prosperitet i socijalna sigurnost.	neutralno
"U doba kada kao žena mogu slobodno oblikovati svoj život.
Duboko sam zahvalna na tome."	neutralno
Greta je važan roman, želim joj dug život i mnogo čitatelja i u hrvatskom prijevodu.	pozitivno
Ruska politika pod Putinom odvijala se u dvije faze: vremenu igara i vremenu krvi.	neutralno
Tim je riječima ruski sociolog Igor Eidman sažeo vladavinu Cara znanstvenici, povjesničarki, slavistici i profesorici na Sveučilištu Rennes II, Cécile Vaissié, koja ga citira u članku objavljenom krajem travnja ove godine na Desk Russie, web stranici koju su sredinom 2021. osnovali iskusni novinari, znanstvenici, povjesničari i drugi stručnjaci za Rusiju i Istočnu Europu kako bi ponudili kvalitetne i provjerene informacije o Rusiji i bivšim sovjetskim republikama.Doba krvi, nastavlja Eidman koji je prije nekoliko godina emigrirao u Njemačku, započelo je 2014. godine ruskom aneksijom Krima, iako se krv prolijevala još od 1999. godine.	neutralno
"Tijekom prve faze, vremena igara, činilo se da ruska ekonomija bilježi rapidne uspjehe, a ""politički tehnolozi"" (specijalisti za političku komunikaciju, kakav je bio i Eidman, pa zna o čemu govori) činili su sve što je bilo potrebno da njihovi kandidati pobijede, da se riješe konkurencije i da glasačima skrenu pažnju s njihovih problema."	neutralno
Sve je izgledalo kao relativno siguran šou, izjavio je Eidman.	neutralno
No ti su politički tehnolozi zapravo sustavno, od 1995. godine, uništavali krhku rusku demokraciju koja je postojala svega nekoliko godina – od 1990. do 1993. godine.	neutralno
"Na početku i jednog i drugog doba – i u doba ""kruha i igara"", i u doba bazena krvi – bio je jedan, ključan čovjek: Vladislav Surkov, poznat i kao sivi kardinal, moderni Rasputin, ruski Richelieu, arhitekt postmoderne politike."	neutralno
Surkov nije inicirao prvo doba, to je važno reći, ali ga je nadgledao i oblikovao od 1999. godine, a odigrao je i ključnu ulogu u tranziciji s igranja na krvarenje.	neutralno
Vladislava Surkova, koji danas ima 58 ili 60 godina, ovisno kojim izvorima vjerujete, odgojila je majka, nakon što ih je, dok je Surkov bio dijete, napustio suprug i otac čečenskog podrijetla.	neutralno
Surkov je služio u vojsci, bio tokar u tvornici, potom tjelohranitelj, a onda i voditelj PR službe bankarskom i naftnom tajkunu Mihailu Hodorkovskom.	neutralno
U međuvremenu je studirao kazališnu režiju, ali je nikad nije završio.	neutralno
Nakon kratke karijere TV redatelja na ruskoj državnoj televiziji postao je asistent šefu Jeljicinove administracije 1999. godine.	neutralno
Kad je Putin naslijedio Kremlj početkom novog milenija, Surkov je postao zamjenik šefa predsjedničke administracije.	neutralno
"Surkov je došao u Kremlj kad je ruska ""demokracija"" bila stara svega osam godina."	neutralno
Mlad i ambiciozan, krenuo je tako da je Putinu najprije sagradio stranku, Jedinstvo, istodobno stvarajući i druge stranke koje su nominalno bile opozicijske, ali zapravo pod kontrolom Kremlja.	neutralno
"Putin je, otkriva Surkov u intervjuu koji je u lipnju 2021. godine u Moskvi dao Henryju Foyu, novinaru Financial Times, uz njegovu pomoć stvorio ""novu vrstu države"", a svojeg tada već bivšeg šefa (u proljeće 2020. Putin i Surkov su se razišli bez objašnjenja) predstavio je kao modernog Oktavijana, rimskog vladara koji je naslijedio Julija Cezara."	neutralno
Oktavijan je, pojasnio je FT-u, zadržao formalne institucije republike, ali svi su zapravo odgovarali jednom čovjeku.	neutralno
Isto je Putin učinio s Rusijom: nije zabranio demokraciju, samo ju je spojio s monarhističkim arhetipom ruske vladavine.	neutralno
Istina je da je Surkov – komentira Foy u uvodu tog neobičnog razgovora – zapravo pomogao udaviti rusku demokraciju koja je bila u povojima i zamijeniti je oslabljenom parodijom, pomno osmišljenom političkom reality televizijom koja je omogućila Vladimiru Putinu da ostane na vlasti 23 godine.	neutralno
"Surkov je jedan od osnivača putinizma, arhitekt ruske ""suverene demokracije"", tobože otvorenog sustava sa zatvorenim, unaprijed određenim ishodima: sazivaju se izbori, kandidati se natječu, daju se glasovi, otvaraju biračke kutije i uvijek pobjeđuje isti čovjek."	neutralno
Glavna ideja suverene demokracije je da je stabilnost države uvijek iznad slobode pojedinca.	neutralno
"Surkovljevim riječima: ""Prevelika količina slobode smrtonosna je za državu."	neutralno
Sve što je lijek može biti i otrov.	neutralno
"Stvar je samo u pravilnom doziranju."""	neutralno
Godine 2011. Surkov je postao zamjenik premijera, no u svibnju 2013. izbačen je iz vlade.	neutralno
Mnogi su se poveselili da je to kraj njegovu utjecaju, no četiri mjeseca kasnije Putin ga je imenovao svojim pomoćnikom, s posebnim zadatkom da nadgleda situaciju u Ukrajini.	neutralno
U veljači 2014. godine, pet mjeseci nakon što je Surkov postavljen na novu funkciju, Rusija je u njegovoj režiji anektirala Krim.	neutralno
"U intervjuu Financial Timesu otprije dvije godine kaže kako su ""Ukrajinci jako dobro svjesni da, u ovom trenutku, njihova država ne postoji u pravom smislu riječi""."	neutralno
"Zemlja se može reformirati u konfederaciju, s mnogo slobode za regije da odlučuju same o sebi.
Dvije susjedne kosti trebaju meko tkivo između sebe.
Ukrajina je točno između Rusije i zapada, a njihova geopolitička gravitacija raspolovit će Ukrajinu.
Dok ne dođemo do tog cilja, borba za Ukrajinu nikad neće prestati.
Možda će se stišati, možda pojačati, no nastavit će se, neizbježno.
Krajem veljače 2022. godine Ruska Federacija pokrenula je masovnu invaziju na Ukrajinu."	neutralno
"Svega par mjeseci kasnije – ne namjerno, nego sa zakašnjenjem zbog pandemije kovida – u Francuskoj, u travnju 2022., Éditions Gallimard objavljuju knjigu ""Mag iz Kremlja"" političkog savjetnika talijansko-švicarskog porijekla."	neutralno
Giuliano da Empoli rukopis je bio predao još u siječnju 2021., a svoj debitantski roman napisao je neplanirano.	neutralno
"U svojem prethodnom djelu, publicističkoj knjizi ""Inženjeri kaosa"", bavio se novim majstorima političke propagande, pa je tako naišao i na Vladislava Surkova."	neutralno
Njegov uspon toliko ga je zaintrigirao da je odlučio o njemu napisati roman koji je u međuvremenu osvojio nagradu za roman godine koji dodjeljuje Francuska akademija.	neutralno
"I ne samo to: čitavo prošlo ljeto, francuski i američki mediji vatreno su raspravljali o ""Magu iz Kremlja"" i njegovoj poruci – je li moguće da je Da Empoli, nehotice, razotkrio staru francusko-rusku ljubav?"	neutralno
Na čijoj je strani zapravo Francuska?	neutralno
Jesu li Putin i Surkov u njegovu romanu negativci ili se čitatelj njima romantično zanosi?	neutralno
"Jer, kako govori glavni junak Da Empolijeva romana: ""Nikad ne treba podcijeniti osjećajnu stranu političkih odnosa."""	neutralno
Mag iz Kremlja doživio je ovih dana svoje hrvatsko izdanje, u nakladi Znanja i prijevodu Ane Šagi.	neutralno
Za očekivati je da će potražnja za njim biti velika jer rat u Ukrajini ne jenjava, a Da Empoli, koji kaže da roman vjerojatno nikad ne bi napisao da je slutio kakav će se pogrom Ukrajini dogoditi, silom (književnih) prilika pretvorio se u traženu osobu.	pozitivno
Daje intervjue, gostuje u televizijskim emisijama, od njega traže mišljenja o Putinu i procjene kako će se situacija na istoku Europe razvijati.	neutralno
"Preko noći postao je stručnjak za ruske ""političke tehnologe"", u Americi ih zovu spin-doktorima, mora se opravdavati i davati razloge za svoje motive pisanja."	neutralno
Surkov se u romanu ne zove Surkov nego Vadim Baranov.	neutralno
"Razlog za promjenu imena nije strah od odmazde ili tužbe; uostalom, Da Empoli u ""Magu iz Kremlja"" Putina jasno zove Putinom, piše o usponu i padu Mihaila Hodorkovskog, ""otkriva"" kako je drugi oligarh, Boris Berezovski, pronašao nasljednika ostarjelom i bolesnom Borisu Jeljcinu u mladom šefu Federalne sigurnosne službe (FSB), dokumentira dugogodišnje prijateljstvo Putina i Jevgenija Prigožina, vlasnika i stvarnog zapovjednika Wagnera, Putinove tajne vojske."	neutralno
"Da Empoli je Surkovu promijenio ime jer Baranov i on naprosto nisu ista osoba: potonji je književni lik, obilato inspiriran ruskim realističkim romanom i nostalgijom za aristokratima staroga kova; pjesnik zalutao među vukove koji se obilato služi kičem jer je ""kič jedini mogući jezik komunikacije s masama zato što sve pojednostavljuje i ne čini razlike""."	neutralno
Hrana mu nisu ni novac ni moć, što Surkovu jesu bili, nego znatiželja koliko se daleko može ići u proizvodnji i režiji zbilje – banalno, karijerni iskorak.	neutralno
"Televiziju i fikciju je, uostalom, bio davno savladao.""Mag iz Kremlja"" počinje dolaskom neimenovanog pripovjedača u Moskvu, profesora na jednom pariškom sveučilištu, kojeg znamo tek kao Zamjatinova čitatelja."	neutralno
"Profesor je, naime, fasciniran distopijskim romanom ""Mi"" Jevgenija Zamjatina, dovršenim 1921. a objavljenim prvi put 1924. u Parizu, u kojem cijelo čovječanstvo budućnosti živi u jednoj državi kojom upravlja Dobrotvor."	neutralno
Ljudi u Jedinstvenoj Državi nemaju imena nego brojeve i žive u staklenim kućama pod nadzorom stražara.	neutralno
Ističući kako je Zamjatin, nakon bijega od Staljina, život skončao u Parizu, profesor je uspio uvjeriti svoje sveučilište da financira istraživanja o njemu.	neutralno
Jedna izdavačka kuća pokazala je blagi interes za novo izdanje romana, a profesorovu prijatelju, producentu dokumentarnih filmova, nije bila mrska ideja da se od toga nešto napravi.	neutralno
Tako je završio u Moskvi, a među ruskim profilima koje je pratio na Facebooku bio je i onaj stanovitog Nicolasa Brandeisa.	neutralno
"Da Empoli voli književne reference: Nicolas Brandeis ime je sporednog lika iz slabije poznatog romana (""Desno i lijevo"") austrougarskog književnika Josepha Rotha, autora ""Radetzky marša"", a koje je Vadim Baranov odabrao kao pseudonim pod kojim je objavljivao kratke eseje, katkad studije vojne strategije namijenjene vojnome vrhu, a ponekad čak i priču kojom bi pokazao svoju paradoksalnu stranu u najboljoj ruskoj tradiciji."	neutralno
"I Vladislav Surkov ima književnih pretenzija: pod svojim je imenom u posljednje dvije godine objavljivao poeziju, a ruski časopis za biznis Vedomosti otkrio je 2009. godine da je Surkov, pod pseudonimom Natan Dubovicki, objavio roman ""Blizu ništici""."	neutralno
